{
  "title": "Go To Statement Considered Harmful",
  "authors": [
    "Edsger W. Dijkstra"
  ],
  "abstract": null,
  "sections": [
    {
      "title": "Structured control flow and understandable execution",
      "pages": {
        "start": 1,
        "end": 2
      },
      "source_span": {
        "start_text": "For a number of years I have been familiar",
        "start_page": 1,
        "end_text": "more transparent than the original one.",
        "end_page": 2
      },
      "summary": "Dijkstra argues that programs should make the relationship between static text and dynamic execution easy to understand. Structured sequencing, conditionals, procedures, and loops provide independent coordinates for reasoning about progress and variable values, whereas unrestricted jumps obscure them; mechanically eliminating jumps alone does not restore clarity."
    }
  ]
}
