{
  "title": "The Extended Mind",
  "authors": [
    "Andy Clark",
    "David Chalmers"
  ],
  "abstract": null,
  "sections": [
    {
      "title": "Cognition beyond the skin",
      "pages": {
        "start": 2,
        "end": 3
      },
      "source_span": {
        "start_text": "Where does the mind stop",
        "start_page": 2,
        "end_text": "Cognitive processes ain't (all) in the head!",
        "end_page": 3
      },
      "summary": "Mental rotation, Tetris, writing, and other external aids motivate a parity argument: operations that would count as cognitive inside the head can also count when performed through the environment. Epistemic actions alter the world to support recognition and reasoning."
    },
    {
      "title": "Active coupling and objections to extended cognition",
      "pages": {
        "start": 3,
        "end": 7
      },
      "source_span": {
        "start_text": "In these cases, the human organism",
        "start_page": 3,
        "end_text": "extended cognition is a core cognitive process, not an add-on extra.",
        "end_page": 7
      },
      "summary": "Active externalism treats organism and reliably coupled resources as one cognitive system, distinguishing present causal involvement from standard externalism about meaning. Replies to consciousness and portability objections draw on reliable access, evolution, learning, and language."
    },
    {
      "title": "External memory as standing belief",
      "pages": {
        "start": 7,
        "end": 9
      },
      "source_span": {
        "start_text": "So far we have spoken largely",
        "start_page": 7,
        "end_text": "and is more useful in explanation.",
        "end_page": 9
      },
      "summary": "Inga’s biological memory and Otto’s notebook can play the same action-guiding role, supporting the claim that beliefs themselves extend beyond the brain. Twin Otto and explanatory simplicity distinguish this thesis from merely historical externalism."
    },
    {
      "title": "Testing the memory–notebook analogy",
      "pages": {
        "start": 9,
        "end": 11
      },
      "source_span": {
        "start_text": "To provide substantial resistance",
        "start_page": 9,
        "end_text": "Otto's notebook has all the relevant dispositions.",
        "end_page": 11
      },
      "summary": "The authors consider differences in reliability, availability, bandwidth, perception, and consciousness between biological and external memory. They argue that these differences do not defeat the analogy once ordinary dispositional beliefs are admitted."
    },
    {
      "title": "Limits, social extension, and personal identity",
      "pages": {
        "start": 11,
        "end": 13
      },
      "source_span": {
        "start_text": "If the thesis is accepted",
        "start_page": 11,
        "end_text": "creatures of the world.",
        "end_page": 13
      },
      "summary": "Constancy, easy access, automatic endorsement, and possibly prior endorsement constrain which external resources constitute beliefs. The argument extends to trusted people, language, the self, and the ethical consequences of interference with cognitive environments."
    }
  ]
}
